"TEMA";"SUBTEMA";"PERGUNTA";"NOME_ARQUIVO_JS"
"Meio Ambiente";"Água Tratada";"Qual é o tamanho da população que usufruem de acesso à água tratada?";"pop_c_agua_trat.csv"
"Meio Ambiente";"Água Tratada";"Qual é o tamanho da população que não usufruem de acesso à água tratada?";"pop_s_agua_trat.csv"
"Meio Ambiente";"Água Tratada";"Qual é o volume de água consumida em Salvador?";"vol_agua_cons.csv"
"Meio Ambiente";"Água Tratada";"Qual é o volume de água consumida percapita em Salvador?";"vol_agua_cons_pc.csv"
"Meio Ambiente";"Coleta de Esgoto";"Qual é o número de pessoas que moram em domicílios com acesso à coleta de esgoto?";"pop_c_coleta_esgoto.csv"
"Meio Ambiente";"Coleta de Esgoto";"Qual é o número de pessoas que moram em domicílios sem acesso à coleta de esgoto?";"pop_s_coleta_esgoto.csv"
"Meio Ambiente";"Coleta de Esgoto";"Qual é o volume de esgoto coletado em Salvador?";"vol_esgoto_col.csv"
"Meio Ambiente";"Coleta de Esgoto";"Qual é o volume de esgoto tratado em Salvador?";"vol_esgoto_trat.csv"
